{
  "id": "chapter_2_start",
  "scene": null,
  "sacred": false,
  "statements": [
    {
      "op": "say",
      "speaker": null,
      "text": "Chapter 2 — The Sunset Walk"
    },
    {
      "op": "say",
      "speaker": null,
      "text": "You and K. are leaving the beach, heading south toward Jaffa."
    },
    {
      "op": "say",
      "speaker": null,
      "text": ""
    },
    {
      "op": "set_flag",
      "flag": "data.knows_name",
      "value": true
    },
    {
      "op": "set_flag",
      "flag": "data.talked_business",
      "value": true
    },
    {
      "op": "set_flag",
      "flag": "data.talked_artist",
      "value": true
    },
    {
      "op": "set_flag",
      "flag": "data.can_go_sunset",
      "value": true
    },
    {
      "op": "set_flag",
      "flag": "data.has_shekel",
      "value": true
    },
    {
      "op": "jump",
      "target": "sunset_scene"
    }
  ]
}
