{
  "id": "kitchen_scene",
  "scene": null,
  "sacred": false,
  "statements": [
    {
      "op": "set_scene",
      "scene": "kitchen"
    },
    {
      "op": "say",
      "speaker": null,
      "text": "The KITCHEN. Steam curls from bamboo baskets."
    },
    {
      "op": "say",
      "speaker": null,
      "text": "K. is making DIM SUM — pleated, plump, glistening."
    },
    {
      "op": "set_flag",
      "flag": "data.has_chopsticks",
      "value": false
    },
    {
      "op": "set_flag",
      "flag": "data.ate_dumplings",
      "value": false
    },
    {
      "op": "set_flag",
      "flag": "data.talked_making",
      "value": false
    },
    {
      "op": "set_flag",
      "flag": "data.talked_love",
      "value": false
    },
    {
      "op": "set_flag",
      "flag": "data.talked_tiger",
      "value": false
    },
    {
      "op": "set_flag",
      "flag": "data.talked_zodiac",
      "value": false
    },
    {
      "op": "set_flag",
      "flag": "data.talked_future",
      "value": false
    },
    {
      "op": "set_flag",
      "flag": "data.has_necklace",
      "value": false
    },
    {
      "op": "jump",
      "target": "kitchen_conversation"
    }
  ]
}
