{
  "id": "talk_to_k_business",
  "scene": null,
  "sacred": false,
  "statements": [
    {
      "op": "if",
      "condition": "(== $data.talked_business false)",
      "then": [
        {
          "op": "jump",
          "target": "talk_to_k_named"
        }
      ]
    },
    {
      "op": "choice",
      "prompt": "What's your business idea?",
      "options": [
        {
          "text": "I'm an ARTIST, I thought to start a dog portrait business",
          "statements": [
            {
              "op": "say",
              "speaker": "k",
              "pose": "idle",
              "text": "A dog portrait painter? I love that."
            },
            {
              "op": "say",
              "speaker": "k",
              "pose": "idle",
              "text": "I know people in the dog world. I've run a shop before."
            },
            {
              "op": "say",
              "speaker": "k",
              "pose": "idle",
              "text": "Let me help you."
            },
            {
              "op": "set_flag",
              "flag": "data.talked_artist",
              "value": true
            },
            {
              "op": "jump",
              "target": "talk_to_k_continue"
            }
          ]
        },
        {
          "text": "Back",
          "statements": [
            {
              "op": "jump",
              "target": "beach_choice"
            }
          ]
        }
      ]
    }
  ]
}
