{
  "id": "sunset_nomad_branch",
  "scene": null,
  "sacred": false,
  "statements": [
    {
      "op": "if",
      "condition": "(== $data.talked_travel false)",
      "then": [
        {
          "op": "jump",
          "target": "sunset_travel_branch"
        }
      ]
    },
    {
      "op": "if",
      "condition": "$data.talked_nomad",
      "then": [
        {
          "op": "jump",
          "target": "sunset_world_branch"
        }
      ]
    },
    {
      "op": "say",
      "speaker": "k",
      "pose": "idle",
      "text": "A nomad works from anywhere. A new view every season."
    },
    {
      "op": "set_flag",
      "flag": "data.talked_nomad",
      "value": true
    },
    {
      "op": "jump",
      "target": "sunset_conversation"
    }
  ]
}
