{
  "id": "sunset_travel_branch",
  "scene": null,
  "sacred": false,
  "statements": [
    {
      "op": "if",
      "condition": "$data.talked_travel",
      "then": [
        {
          "op": "jump",
          "target": "sunset_nomad_branch"
        }
      ]
    },
    {
      "op": "say",
      "speaker": "k",
      "pose": "idle",
      "text": "I love to travel. I've been everywhere I could."
    },
    {
      "op": "say",
      "speaker": "k",
      "pose": "idle",
      "text": "My dream is to live as a digital nomad."
    },
    {
      "op": "set_flag",
      "flag": "data.talked_travel",
      "value": true
    },
    {
      "op": "jump",
      "target": "sunset_conversation"
    }
  ]
}
