{
  "id": "sunset_sweet_branch",
  "scene": null,
  "sacred": false,
  "statements": [
    {
      "op": "if",
      "condition": "$data.talked_sweet",
      "then": [
        {
          "op": "jump",
          "target": "sunset_travel_branch"
        }
      ]
    },
    {
      "op": "say",
      "speaker": "k",
      "pose": "idle",
      "text": "Ice cream. I'd eat it in winter. What about you?"
    },
    {
      "op": "set_flag",
      "flag": "data.talked_sweet",
      "value": true
    },
    {
      "op": "jump",
      "target": "sunset_sweet"
    }
  ]
}
