{
  "id": "chapter_3_start",
  "scene": null,
  "sacred": false,
  "statements": [
    {
      "op": "say",
      "speaker": null,
      "text": "Chapter 3 — Jaffa Nights"
    },
    {
      "op": "say",
      "speaker": null,
      "text": "Your Jaffa apartment. K. is beside you. Tomorrow you leave for Japan."
    },
    {
      "op": "say",
      "speaker": null,
      "text": ""
    },
    {
      "op": "set_flag",
      "flag": "data.knows_name",
      "value": true
    },
    {
      "op": "set_flag",
      "flag": "data.talked_business",
      "value": true
    },
    {
      "op": "set_flag",
      "flag": "data.talked_artist",
      "value": true
    },
    {
      "op": "set_flag",
      "flag": "data.can_go_sunset",
      "value": true
    },
    {
      "op": "set_flag",
      "flag": "data.has_shekel",
      "value": true
    },
    {
      "op": "set_flag",
      "flag": "data.talked_food",
      "value": true
    },
    {
      "op": "set_flag",
      "flag": "data.talked_mango",
      "value": true
    },
    {
      "op": "set_flag",
      "flag": "data.talked_drink",
      "value": true
    },
    {
      "op": "set_flag",
      "flag": "data.talked_tea",
      "value": true
    },
    {
      "op": "set_flag",
      "flag": "data.talked_sweet",
      "value": true
    },
    {
      "op": "set_flag",
      "flag": "data.talked_chocolate",
      "value": true
    },
    {
      "op": "set_flag",
      "flag": "data.talked_travel",
      "value": true
    },
    {
      "op": "set_flag",
      "flag": "data.talked_nomad",
      "value": true
    },
    {
      "op": "set_flag",
      "flag": "data.talked_world",
      "value": true
    },
    {
      "op": "set_flag",
      "flag": "data.talked_japan",
      "value": true
    },
    {
      "op": "set_flag",
      "flag": "data.talked_china",
      "value": false
    },
    {
      "op": "set_flag",
      "flag": "data.agreed_to_travel",
      "value": true
    },
    {
      "op": "set_flag",
      "flag": "data.can_fly",
      "value": true
    },
    {
      "op": "jump",
      "target": "jaffa_apt_scene"
    }
  ]
}
